{"version":1,"default_timeout_ms":500,"cores":[{"id":"remote-a","kind":"http","options":{"url":"http://127.0.0.1:9001","token_env":"A_TOKEN","timeout_ms":300}},{"id":"local-b","kind":"some-custom-kind","capabilities":["x.v1.y"],"options":{"anything":true}}],"bindings":[{"capability":"x.v1.y","cores":["local-b","remote-a"]}],"serve":{"listen":"0.0.0.0:8080","token_env":"P_TOKEN"},"extensions":{"mine":{"layers":["whatever","I","mount"]}}}
